{
  "id": "b1-sd15-pruned-emaonly-comfyui-video-sequence",
  "version": "451f4fe16113bff5a5d2269ed5ad43b0592e9a14",
  "display_name": "Stable Diffusion 1.5 Animated Sequence Starter for ComfyUI",
  "description": "Experimental 6 GB VRAM starter for proving the managed text-to-video queue path on the initial B1 AI Hub host. It generates a tiny SD 1.5 image batch and packages the frames as an animated GIF through the B1 ComfyUI hook; it is not a high-quality temporal video model.",
  "modality": "video",
  "operations": ["video-generation"],
  "source": {
    "type": "huggingface",
    "url": "https://huggingface.co/stable-diffusion-v1-5/stable-diffusion-v1-5",
    "revision": "451f4fe16113bff5a5d2269ed5ad43b0592e9a14",
    "sha256": "6ce0161689b3853acaa03779ec93eafe75a02f4ced659bee03f50797806fa2fa"
  },
  "files": [
    {
      "path": "diffusion/checkpoints/sd-v1-5-pruned-emaonly-b1-video.safetensors",
      "source_path": "v1-5-pruned-emaonly.safetensors",
      "sha256": "6ce0161689b3853acaa03779ec93eafe75a02f4ced659bee03f50797806fa2fa",
      "size_bytes": 4265146304,
      "format": "safetensors",
      "quantization": "fp32-pruned-emaonly"
    }
  ],
  "runtimes": ["comfyui"],
  "preferred_runtime": "comfyui",
  "resource_estimate": {
    "vram_gib": 4.9,
    "ram_gib": 8.0,
    "disk_gib": 3.98,
    "max_resolution": "192x192",
    "max_frames": 4
  },
  "license": {
    "name": "CreativeML Open RAIL-M",
    "url": "https://huggingface.co/stable-diffusion-v1-5/stable-diffusion-v1-5",
    "redistribution": "downloadable",
    "attribution": "Stable Diffusion v1.5, RunwayML and Stability AI",
    "acceptance_required": true
  },
  "execution_modes": ["hosted-inference", "downloadable"],
  "installation_status": "available",
  "aliases": ["sd15-video-sequence"],
  "visibility_roles": ["admin", "operator", "creator"],
  "runtime_adapter_versions": {
    "comfyui": "b1-runtime-adapter/v1alpha1"
  },
  "runtime_smoke": {
    "schema": "b1-ai-hub-runtime-smoke/v1",
    "description": "Tiny 192x192, 4-frame, 3-step native ComfyUI SD 1.5 prompt that emits an animated GIF through B1RuntimeSaveAnimatedGif.",
    "comfyui": {
      "timeout_seconds": 900,
      "prompt": {
        "3": {
          "class_type": "CheckpointLoaderSimple",
          "inputs": {
            "ckpt_name": "sd-v1-5-pruned-emaonly-b1-video.safetensors"
          }
        },
        "4": {
          "class_type": "CLIPTextEncode",
          "inputs": {
            "text": "four colorful geometric animation frames, clean composition, simple motion",
            "clip": ["3", 1]
          }
        },
        "5": {
          "class_type": "CLIPTextEncode",
          "inputs": {
            "text": "text, watermark, low quality, blurry",
            "clip": ["3", 1]
          }
        },
        "6": {
          "class_type": "EmptyLatentImage",
          "inputs": {
            "width": 192,
            "height": 192,
            "batch_size": 4
          }
        },
        "7": {
          "class_type": "KSampler",
          "inputs": {
            "seed": 20260726,
            "steps": 3,
            "cfg": 4.5,
            "sampler_name": "euler",
            "scheduler": "normal",
            "denoise": 1.0,
            "model": ["3", 0],
            "positive": ["4", 0],
            "negative": ["5", 0],
            "latent_image": ["6", 0]
          }
        },
        "8": {
          "class_type": "VAEDecode",
          "inputs": {
            "samples": ["7", 0],
            "vae": ["3", 2]
          }
        },
        "9": {
          "class_type": "B1RuntimeSaveAnimatedGif",
          "inputs": {
            "images": ["8", 0],
            "filename_prefix": "b1-model-smoke/sd15-video-sequence",
            "fps": 4,
            "max_frames": 4,
            "loop": true
          }
        }
      }
    }
  },
  "measurements": {
    "schema": "b1-ai-hub-model-measurements/v1",
    "updated_at": "2026-07-26T23:00:00+00:00",
    "source": "catalog seed from pinned Hugging Face metadata; live RTX 3060 Laptop 6 GB animated-sequence smoke required before handoff",
    "original_resource_estimate": {
      "vram_gib": 4.9,
      "ram_gib": 8.0,
      "disk_gib": 3.98,
      "max_resolution": "192x192",
      "max_frames": 4
    },
    "latest_resource_estimate": {
      "vram_gib": 4.9,
      "ram_gib": 8.0,
      "disk_gib": 3.98,
      "max_resolution": "192x192",
      "max_frames": 4
    },
    "runs": [
      {
        "id": "sd15-video-sequence-catalog-metadata-20260726",
        "type": "catalog-metadata",
        "status": "ok",
        "runtime": "comfyui",
        "model_alias": "sd15-video-sequence",
        "resolved_model_version": "b1-sd15-pruned-emaonly-comfyui-video-sequence@451f4fe16113bff5a5d2269ed5ad43b0592e9a14",
        "peak_vram_mib": 5018,
        "peak_ram_mib": 8192,
        "hook": {
          "status": "unconfirmed",
          "reason": "catalog_metadata_not_runtime_smoke"
        }
      }
    ]
  }
}
