{
  "id": "b1-xinntao-realesrgan-x4plus-comfyui", "version": "v0.1.0", "display_name": "Real-ESRGAN x4plus Native ComfyUI", "description": "Official Real-ESRGAN x4 restoration weight for B1-managed ComfyUI image upscaling.",
  "modality": "image", "operations": ["upscaling"],
  "source": {"type": "direct-url", "url": "https://github.com/xinntao/Real-ESRGAN/releases/download/v0.1.0/RealESRGAN_x4plus.pth", "revision": "v0.1.0", "sha256": "4fa0d38905f75ac06eb49a7951b426670021be3018265fd191d2125df9d682f1"},
  "files": [{"path": "diffusion/upscale_models/RealESRGAN_x4plus.pth", "sha256": "4fa0d38905f75ac06eb49a7951b426670021be3018265fd191d2125df9d682f1", "size_bytes": 67040989, "format": "pth", "quantization": "fp32"}],
  "runtimes": ["comfyui"], "preferred_runtime": "comfyui", "resource_estimate": {"vram_gib": 2.0, "ram_gib": 2.0, "disk_gib": 0.07, "max_resolution": "2048x2048"},
  "license": {"name": "BSD-3-Clause", "url": "https://github.com/xinntao/Real-ESRGAN/blob/master/LICENSE", "redistribution": "downloadable", "attribution": "Real-ESRGAN by Xintao Wang and contributors", "acceptance_required": false},
  "execution_modes": ["hosted-inference", "downloadable"], "installation_status": "available", "aliases": ["image-upscale", "realesrgan-x4plus"], "visibility_roles": ["admin", "operator", "creator", "user", "service"], "runtime_adapter_versions": {"comfyui": "b1-runtime-adapter/v1alpha1"},
  "measurements": {"schema": "b1-ai-hub-model-measurements/v1", "updated_at": "2026-07-28T00:00:00+00:00", "source": "Official Real-ESRGAN v0.1.0 release file metadata. A local smoke run records final measurements before production use.", "original_resource_estimate": {"vram_gib": 2.0, "ram_gib": 2.0, "disk_gib": 0.07, "max_resolution": "2048x2048"}, "latest_resource_estimate": {"vram_gib": 2.0, "ram_gib": 2.0, "disk_gib": 0.07, "max_resolution": "2048x2048"}, "runs": [{"id": "realesrgan-x4plus-catalog-metadata-20260728", "type": "catalog-metadata", "status": "ok", "runtime": "comfyui", "model_alias": "image-upscale", "resolved_model_version": "b1-xinntao-realesrgan-x4plus-comfyui@v0.1.0", "peak_vram_mib": 2048, "peak_ram_mib": 2048, "hook": {"status": "unconfirmed", "reason": "catalog_metadata_not_runtime_smoke"}}]}
}
